{
  "OPERATION_ID" : "348snd-32sd-wwd3-2kdjs3",
  "MDM_ID" : "1223134231",
  "EVENT_DTTM" : "2022-02-01 09:54:00",
  "OPERATION_AMOUNT" : "1000.012",
  "GOAL_CURRENCY" : "RUB",
  "TRADING_PLATFORM" : "основной рынок",
  "BALANCE_BEFORE_OPERATION" : "1000",
  "INTERACTION_CHANNEL" : "SALARY",
  "OPERATION_TYPE" : "REFUND",
  "SOURCE_ACCOUNT" : "4081781***********8309",
  "SOURCE_ACCOUNT_BIC" : "BIC.044525745",
  "SOURCE_ACCOUNT_TYPE" : "CURRENT_ACCOUNT",
  "TARGET_ACCOUNT" : "4081781***********8309",
  "TARGET_ACCOUNT_BIC" : "BIC.044525745",
  "TARGET_ACCOUNT_TYPE" : "BROKERAGE_ACCOUNT",
  "CREDIT_TRANSACTION_ID": "TS.0000002263298966"
}
